{"account_ref":{"id":"synthetic-account","namespace":"internal_alias"},"attribution_tier":"NOT_AVAILABLE","campaign_ref":"synthetic-campaign","cohort":"synthetic-cohort","denominator":null,"measurement_window":["2026-10-03T00:00:00+07:00","2026-10-05T00:00:00+07:00"],"metric_definition_version":"synthetic-1","metric_definitions":[{"cohort":"synthetic-cohort","comparison_policy":"NO_CROSS_PROVIDER_EQUIVALENCE","definition":"Synthetic count for an offline example","definition_version":"synthetic-1","denominator":null,"metric_key":"plays","platform":"TIKTOK","provider_name":"Synthetic plays","schema_version":"MetricDefinition.v1","source_status":"USER_SUPPLIED_NOT_LIVE_VERIFIED","unit":"count"}],"missingness_rule":"Missing is null, never zero","plan_id":"synthetic-observations","platform":"TIKTOK","primary_metric":"plays","schema_version":"MeasurementPlan.v1","source_mode":"MANUAL_IMPORT","source_status":"USER_SUPPLIED_NOT_LIVE_VERIFIED","surface":"VIDEO","timezone":"UTC+07:00"}